### ISSUE TITLE
cowboy keep alive no response

### ISSUE THREAD

**Issue by memacs** [ninenines/cowboy#1344]
when I user java HttpClient to request cowboy, the second request  has no response

```
12:51:34.530738 IP localhost.50744 > localhost.zabbix-agent: Flags [P.], seq 376771705:376773557, ack 2326142599, win 65, length 1852
E..d.+@.@.  n
Z..
Z...8'B.u.y....P..A.Q..POST /qchat/send_thirdmessage HTTP/1.1
Content-Length: 1613
Content-Type: application/json; charset=UTF-8
Host: localhost.qunar.com:10050
Connection: Keep-Alive
User-Agent: qchat_api(java)
Accept-Encoding: gzip,deflate

[{"from":"hotel_pre_saleguangzhou_18657@ejabhost2","to":"yrkajyl9323@ejabhost2","message":"<message from=\"hotel_pre_saleguangzhou_18657@ejabhost2\" to=\"yrkajyl9323@ejabhost2\" bu=\"hotel_pre_sale\" qchatid=\"\" type=\"consult\" cctext=\"\" channelid=\"{&quot;d&quot;:&quot;send&quot;,&quot;usrType&quot;:&quot;usr&quot;,&quot;cn&quot;:&quot;hotel_pre_sale&quot;}\" realfrom=\"hotel_pre_sale100001@ejabhost2\" realto=\"yrkajyl9323@ejabhost2\"><body extendInfo=\"\" backupinfo=\"\" msgType=\"1\" maType=\"20\" id=\"hotel_pre_sale-ec0e1c66107d4b96ae2798209725fe35\">Qmi..........................................</body></message>"},{"from":"hotel_pre_saleguangzhou_18657@ejabhost2","to":"yrkajyl9323@ejabhost2","message":"<message from=\"hotel_pre_saleguangzhou_18657@ejabhost2\" to=\"yrkajyl9323@ejabhost2\" bu=\"hotel_pre_sale\" qchatid=\"\" type=\"consult\" cctext=\"\" channelid=\"{&quot;d&quot;:&quot;send&quot;,&quot;usrType&quot;:&quot;usr&quot;,&quot;cn&quot;:&quot;hotel_pre_sale&quot;}\" realfrom=\"hotel_pre_sale100001@ejabhost2\" realto=\"yrkajyl9323@ejabhost2\"><body extendInfo=\"{&quot;hints&quot;:[{&quot;text&quot;:&quot;..............................~&quot;,&quot;event&quot;:{&quot;extend&quot;:&quot;{\\&quot;hotelSeq\\&quot;:\\&quot;guangzhou_18657\\&quot;,\\&quot;type\\&quot;:\\&quot;1\\&quot;,\\&quot;uid\\&quot;:\\&quot;yrkajyl9323\\&quot;}&quot;,&quot;msgText&quot;:&quot;..............................~&quot;,&quot;type&quot;:&quot;extext&quot;}}]}\" backupinfo=\"\" msgType=\"65537\" maType=\"20\" id=\"hotel_pre_sale-3a466e4baa7f40f7b0852c3d0f8bc3c1\">body is empty.</body></message>"}]
12:51:34.537332 IP localhost.zabbix-agent > localhost.50744: Flags [P.], seq 1:217, ack 1852, win 72, length 216
E.....@.@..&
Z..
Z..'B.8.....u..P..H....HTTP/1.1 200 OK
connection: keep-alive
server: Cowboy
date: Thu, 13 Dec 2018 04:51:33 GMT
content-length: 53
content-type: application/json; charset=utf-8

{"ret":true,"errcode":0,"errmsg":"success","data":""}
12:51:37.177221 IP localhost.50744 > localhost.zabbix-agent: Flags [P.], seq 1852:2738, ack 217, win 67, length 886
2....-@.@.
Z..
Z...8'B.u....._P..C....POST /qchat/send_thirdmessage HTTP/1.1
Content-Length: 648
Content-Type: application/json; charset=UTF-8
Host: localhost.qunar.com:10050
Connection: Keep-Alive
User-Agent: qchat_api(java)
Accept-Encoding: gzip,deflate

[{"from":"hotel_pre_saleguangzhou_18657@ejabhost2","to":"yrkajyl9323@ejabhost2","message":"<message from=\"hotel_pre_saleguangzhou_18657@ejabhost2\" to=\"yrkajyl9323@ejabhost2\" bu=\"hotel_pre_sale\" qchatid=\"\" type=\"consult\" cctext=\"\" channelid=\"{&quot;d&quot;:&quot;send&quot;,&quot;usrType&quot;:&quot;usr&quot;,&quot;cn&quot;:&quot;hotel_pre_sale&quot;}\" realfrom=\"hotel_pre_sale100001@ejabhost2\" realto=\"yrkajyl9323@ejabhost2\"><body extendInfo=\"\" backupinfo=\"\" msgType=\"1\" maType=\"20\" id=\"hotel_pre_sale-44612ae778ea4d2b89f4c594952ab36f\">...............................................................</body></message>"}]
12:51:40.667022 IP localhost.50745 > localhost.zabbix-agent: Flags [P.], seq 4194112204:4194113090, ack 2925426284, win 65, length 886
E.....@.@...
Z..
Z...9'B.....^vlP..A....POST /qchat/send_thirdmessage HTTP/1.1
Content-Length: 648
Content-Type: application/json; charset=UTF-8
Host: localhost.qunar.com:10050
Connection: Keep-Alive
User-Agent: qchat_api(java)
Accept-Encoding: gzip,deflate

[{"from":"hotel_pre_saleguangzhou_18657@ejabhost2","to":"yrkajyl9323@ejabhost2","message":"<message from=\"hotel_pre_saleguangzhou_18657@ejabhost2\" to=\"yrkajyl9323@ejabhost2\" bu=\"hotel_pre_sale\" qchatid=\"\" type=\"consult\" cctext=\"\" channelid=\"{&quot;d&quot;:&quot;send&quot;,&quot;usrType&quot;:&quot;usr&quot;,&quot;cn&quot;:&quot;hotel_pre_sale&quot;}\" realfrom=\"hotel_pre_sale100001@ejabhost2\" realto=\"yrkajyl9323@ejabhost2\"><body extendInfo=\"\" backupinfo=\"\" msgType=\"1\" maType=\"20\" id=\"hotel_pre_sale-90b40dcedf5b43aa98502e8f978a31b4\">...............................................................</body></message>"}]
12:51:40.671494 IP localhost.zabbix-agent > localhost.50745: Flags [P.], seq 1:217, ack 886, win 68, length 216
E....&@.@...
Z..
Z..'B.9.^vl...BP..D....HTTP/1.1 200 OK
connection: keep-alive
server: Cowboy
date: Thu, 13 Dec 2018 04:51:40 GMT
content-length: 53
content-type: application/json; charset=utf-8

{"ret":true,"errcode":0,"errmsg":"success","data":""}

```

The first two request tcp port is same, the third is changed.

**Comment by memacs** [comment]
the code is

```
-module(http_dispatch).

-export([init/3]).
-export([handle/2]).
-export([terminate/3]).
-include("ejabberd.hrl").
-include("logger.hrl").

init(_Transport, Req, []) ->
        {ok, Req, undefined}.

handle(Req, State) ->
    {Method, _} = cowboy_req:method(Req),
    {Path, _} = cowboy_req:path_info(Req),
    {ok, Req1} = handle_process(Path, Req),
    {ok, Req1, State}.

terminate(_Reason, _Req, _State) ->
    ok.

handle_process([<<"send_thirdmessage">>], Req) ->
    http_send_thirdmessage:handle(Req);
handle_process(_, Req) ->
    http_utils:cowboy_req_reply_json(http_utils:gen_fail_result(1, <<"request not defined">>), Req).
```

```
-module(http_send_thirdmessage).
    
-export([handle/1]).
-include("ejabberd.hrl").
-include("logger.hrl").

handle(Req) ->
    {Method, _} = cowboy_req:method(Req),
    case Method of
        <<"POST">> ->
            send_message(Req);
        _ ->
            http_utils:cowboy_req_reply_json(http_utils:gen_fail_result(1, <<Method/binary, " is not disable">>), Req)
    end.

send_message(Req)->
    {ok, Body, _} = cowboy_req:body(Req),
    case rfc4627:decode(Body) of
        {ok, {obj,Args},[]} -> 
            do_send_messages([{obj, Args}]),
            http_utils:cowboy_req_reply_json(http_utils:gen_success_result(), Req);
        {ok, Msgs, []} when is_list(Msgs) ->
            do_send_messages(Msgs),
            http_utils:cowboy_req_reply_json(http_utils:gen_success_result(), Req);
        _ ->
            http_utils:cowboy_req_reply_json(http_utils:gen_fail_result(1, <<"Josn parse error">>), Req)
    end.

do_send_messages([]) -> ok;
do_send_messages([{obj, Args}|Rest]) ->
    From = proplists:get_value("from",Args),
    To = proplists:get_value("to",Args),
    Message = proplists:get_value("message",Args),
    JFrom = jlib:string_to_jid(From),
    JTo = jlib:string_to_jid(To),
    Packet = fxml_stream:parse_element(Message),
    catch monitor_util:monitor_count(<<"rpc_thirdparty_chat_message">>,1),
    catch qtalk_c2s:carbon_message(JFrom, JTo, Packet),
    ejabberd_router:route(JFrom,JTo,Packet),
    do_send_messages(Rest).
```

**Comment by memacs** [comment]
thanks
